{
  "version": 1,
  "name": "Quick test 4x50",
  "pool_length_m": 25,
  "blocks": [
    { "name": "Main", "repeat": 1, "sets": [
      { "reps": 4, "distance_m": 50, "stroke": "freestyle", "intensity": "moderate", "goal_s": 45, "notes": "Los en ontspannen, lange slagen",
        "rest": { "type": "fixed", "seconds": 20 } } ] }
  ]
}
