{
  "version": 1,
  "name": "Threshold 2k",
  "pool_length_m": 25,
  "blocks": [
    { "name": "Warm-up", "repeat": 1, "sets": [
      { "reps": 1, "distance_m": 400, "stroke": "any", "intensity": "easy" } ] },
    { "name": "Main", "repeat": 2, "sets": [
      { "reps": 4, "distance_m": 100, "stroke": "freestyle", "intensity": "threshold", "goal_s": 95,
        "equipment": ["pull_buoy", "paddles"], "rest": { "type": "interval", "seconds": 105 } },
      { "reps": 1, "distance_m": 200, "stroke": "backstroke", "intensity": "easy",
        "rest": { "type": "fixed", "seconds": 30 } } ] }
  ]
}
